{
  "event": "project:update",
  "message": "john.smith updated project Translation Project",
  "user": {
    "id": "24b9a53ad72e198ca332fba91bb95f57",
    "username": "john.smith",
    "name": "John Smith",
    "gravatar_uid": "1bc5edb4799fd8eec67c66122f47eb73"
  },
  "project": {
    "id": "b2abd3bd2c23ff0ac546e0a2d9aa0be1",
    "name": "Translation Project",
    "slug": "translation-project",
    "main_format": "yml",
    "project_image_url": null,
    "created_at": "2025-02-07 16:18:13 UTC",
    "updated_at": "2025-02-07 16:18:13 UTC",
    "account": {
      "id": "abcdef1",
      "name": "Company account",
      "slug": "company-account",
      "company": "Pawtucket Brewery",
      "created_at": "2025-02-07 16:18:13 UTC",
      "updated_at": "2025-02-07 16:44:04 UTC",
      "company_logo_url": null
    },
    "space": null,
    "point_of_contact": null
  },
  "branch": {
    "name": "new-feature-1"
  }
}